{
  "name": "steelwolf-empire-plugins",
  "owner": {
    "name": "Luke SteelWolf",
    "url": "https://github.com/lucatrading21-debug"
  },
  "metadata": {
    "description": "SteelWolf Empire — Claude plugins marketplace per workflow operations Empire ecosystem (Trading Alliance, IronX, TA-Academy, Empire Hub). Pattern Anthropic 2026 native con dual skills+commands+hooks. Compatible Claude Code CLI, Cowork desktop, Claude.ai web.",
    "version": "1.21.0",
    "homepage": "https://github.com/lucatrading21-debug/steelwolf-empire-plugins",
    "repository": "https://github.com/lucatrading21-debug/steelwolf-empire-plugins",
    "license": "UNLICENSED",
    "keywords": [
      "claude",
      "claude-code",
      "claude-cowork",
      "anthropic",
      "plugins",
      "marketplace",
      "empire",
      "steelwolf",
      "workflow",
      "session-management"
    ]
  },
  "plugins": [
    {
      "name": "swe",
      "source": "./plugins/swe",
      "version": "1.19.0",
      "description": "SteelWolf Empire workflow plugin. Slash commands per apertura sessione (/swe:start), chiusura interattiva (/swe:end), ciclo end+start (/swe:cycle), compact mid-session (/swe:compact). Auto-discovery via skills + slash explicit invocation via commands + lifecycle hooks (SessionStart, SessionEnd, UserPromptSubmit forced-eval 84-100% activation). LL-Empire binding governance V1-V6, PROTOCOLLO GO non derogabile, dual-PC parity PREDATOR/ACE.",
      "author": {
        "name": "Luke SteelWolf"
      },
      "keywords": [
        "empire",
        "session",
        "workflow",
        "governance"
      ]
    },
    {
      "name": "empire-research",
      "source": "./plugins/empire-research",
      "version": "1.0.0",
      "description": "Empire research enforcement — WebFetch + WebSearch verifica empirica live di schema/spec/feature esterno Anthropic PRIMA di proporre architettura. Anti-confabulation pattern LL-Empire-011 + LL-Empire-024. Trigger naturale o /empire-research:research [topic].",
      "author": {
        "name": "Luke SteelWolf"
      },
      "keywords": [
        "empire",
        "research",
        "verification",
        "anti-confabulation"
      ]
    },
    {
      "name": "empire-core",
      "source": "./plugins/empire-core",
      "version": "1.0.0",
      "description": "SteelWolf Empire core utilities plugin. Cross-workspace governance: empire-quality (checklist pre-commit cross-repo Empire-wide, zero-regression rule, criteri accettazione) + empire-pattern-detector (sistema rilevamento pattern v4.0 T1-T7, Pre-Mortem Q1-Q5 LL-Empire-004 gate, context-aware project detection, IronX firewall §11). Slash commands /empire-core:quality e /empire-core:detector. M2 P2 Fase 1 closure 2026-04-30.",
      "author": {
        "name": "Luke SteelWolf"
      },
      "keywords": [
        "empire",
        "quality",
        "pattern-detection",
        "governance",
        "pre-mortem",
        "cross-workspace"
      ]
    },
    {
      "name": "ironx-suite",
      "source": "./plugins/ironx-suite",
      "version": "1.0.0",
      "description": "IronX Ecosystem skill suite — 15 skill di dominio per sviluppo indicatori/EA/bot cross-platform NinjaTrader 8 (NinjaScript C#), MetaTrader 5 (MQL5), TradingView (PineScript v6): prime, ecosystem, platform-matrix, nt8, mql5, pinescript, signals, bar-types, alerts, confluence, research, engineer, quality, docs, session. Knowledge base read-context, rispetta freeze V5 (ADR-007).",
      "author": {
        "name": "Luke SteelWolf"
      },
      "keywords": [
        "empire",
        "ironx",
        "trading",
        "ninjatrader",
        "metatrader",
        "tradingview",
        "cross-platform"
      ]
    }
  ]
}
